{
  "schema_version": "2.0",
  "job_id": "22222222-2222-4222-8222-222222222222",
  "session_id": "11111111-1111-4111-8111-111111111111",
  "input_artifact": {
    "provider": "google_drive",
    "file_id": "synthetic-file-id-001",
    "revision": "synthetic-revision-001",
    "sha256": "aaaaaaaaaaaaaaaaaaaaaaaaaaaaaaaaaaaaaaaaaaaaaaaaaaaaaaaaaaaaaaaa",
    "size_bytes": 1024,
    "mime_type": "application/zip",
    "role": "raw_package"
  }
}
